{
    "$schema": "https://json-schema.org/draft/2020-12/schema",
    "type":"object",
    "properties": 
    {
        "name":{"type":"string"},
        "age":{"type":"integer"},
        "email":{"type":"string","format": "email"},
        "result":{"type":"string","enum": ["passed","failed"]}
    }
}